{
  "version": 3,
  "updatedAt": "2026-08-31T20:36:55Z",
  "updatedBy": "Product Owner: add Artist performance variants and consolidation",
  "title": "bndy workboard",
  "description": "Single view of active bndy product, platform, ingestion, intelligence and growth work.",
  "principles": [
    "Canonical BNDY APIs remain the write authority.",
    "Capture is transport and durable intake, not the intelligence engine.",
    "Enrichment is the strategic resolution and intelligence runtime.",
    "BNDY Backline is the capability/product name; bndy-enrichment remains the single strategic Backline runtime rather than creating a parallel repository.",
    "All new ingestion paths should converge on Capture + Enrichment rather than inventing another write path.",
    "The target state is evidence -> claims -> projection -> canonical BNDY, not source -> direct database write.",
    "BNDY Backline is the durable intelligence substrate: immutable evidence plus observations and atomised claims feed policy and projection; the graph is a derived view, not the authority.",
    "Healthy source delivery requires both ingestion health and evidence-backed enrichment health; blank or explicitly unknown is safer than an invented classification or a wrong identity link."
  ],
  "activityRepos": [
    "flowency-live/bndy-app",
    "flowency-live/bndy-serverless-api",
    "flowency-live/bndy-backstage",
    "flowency-live/bndy-website",
    "flowency-live/bndy-chatzone",
    "flowency-live/bndy-capture",
    "flowency-live/bndy-enrichment",
    "flowency-live/bndy-MCP",
    "flowency-live/bndy-ops"
  ],
  "repositories": [
    {
      "id": "app",
      "repo": "flowency-live/bndy-app",
      "serves": "https://bndy.live",
      "role": "Core public gig discovery PWA: map, gigs, artists, venues, festivals, favourites and public add flows.",
      "status": "production"
    },
    {
      "id": "api",
      "repo": "flowency-live/bndy-serverless-api",
      "serves": "Canonical BNDY backend",
      "role": "Authoritative artists, venues, events, festivals, auth, curator policy, source inspection and edition-aware APIs.",
      "status": "production"
    },
    {
      "id": "backstage",
      "repo": "flowency-live/bndy-backstage",
      "serves": "BNDY Backstage / Godmode",
      "role": "Admin operations, curator policy management and traffic visibility.",
      "status": "production"
    },
    {
      "id": "website",
      "repo": "flowency-live/bndy-website",
      "serves": "https://www.bndy.co.uk",
      "role": "Public brand, proposition, policy and architecture pages. The workboard lives here.",
      "status": "production"
    },
    {
      "id": "chatzone",
      "repo": "flowency-live/bndy-chatzone",
      "serves": "https://chat.bndy.live",
      "role": "Public Dropzone UI for gig poster and text submission. Routes into Capture.",
      "status": "production"
    },
    {
      "id": "capture",
      "repo": "flowency-live/bndy-capture",
      "serves": "https://capture.bndy.co.uk + Android APK",
      "role": "Durable intake transport for Android Send to bndy and public web submissions. Stores evidence and queue state.",
      "status": "production"
    },
    {
      "id": "enrichment",
      "repo": "flowency-live/bndy-enrichment",
      "serves": "AWS BNDY Backline runtime",
      "role": "Strategic Backline runtime for source acquisition, immutable evidence, observations, atomised claims, identity resolution, authority, projection, Capture processing and enrichment.",
      "status": "active"
    },
    {
      "id": "ops",
      "repo": "flowency-live/bndy-ops",
      "serves": "Cowork operational evidence",
      "role": "Live Cowork task definitions, source snapshots, cursors, state, machine run ledgers and human run reports. It is an operational evidence source for Backline, not a second strategic runtime or canonical authority.",
      "status": "support"
    },
    {
      "id": "mcp",
      "repo": "flowency-live/bndy-MCP",
      "serves": "Agent/MCP adapter",
      "role": "Thin agent-facing adapter around BNDY capabilities. Needs a current-role audit as Enrichment becomes the orchestration layer.",
      "status": "support"
    },
    {
      "id": "signals",
      "repo": "flowency-live/bndy-signals",
      "serves": "Legacy signals runtime",
      "role": "Older Signal -> interpretation -> claims implementation. Useful concepts should be absorbed then the runtime retired.",
      "status": "legacy"
    },
    {
      "id": "frontstage",
      "repo": "flowency-live/bndy-frontstage",
      "serves": "Decommissioned",
      "role": "Previous public application. Do not use for new work.",
      "status": "decommissioned"
    },
    {
      "id": "types",
      "repo": "flowency-live/bndy-types",
      "serves": "Shared package",
      "role": "Shared type definitions used by older/newer surfaces where applicable.",
      "status": "support"
    },
    {
      "id": "ui",
      "repo": "flowency-live/bndy-ui",
      "serves": "Shared package",
      "role": "Shared UI package from the earlier application generation. Audit before expanding usage.",
      "status": "support"
    },
    {
      "id": "legacy-other",
      "repo": "flowency-live/bndy.live, bndylivebeta, bndy-centrestage, bndy-portal, bndy-api, bndy-infrastructure",
      "serves": "Legacy / audit required",
      "role": "Older BNDY generations. Confirm no live dependency, then archive or label clearly to reduce agent confusion.",
      "status": "audit"
    }
  ],
  "backlog": [
    {
      "id": "scene-view",
      "rank": 1,
      "laneId": "core-discovery",
      "title": "Poster-led Scene view for local discovery",
      "detail": "Add a future third public discovery mode alongside Map and List. Scene is a finite, location- and date-bounded visual view of canonical gigs, led by authentic posters where available and deterministic BNDY event cards otherwise. It is not a general user-post, comment or infinite-scroll social feed. Delivery is approved but deliberately unscheduled."
    },
    {
      "id": "ask-bndy",
      "rank": 2,
      "laneId": "core-discovery",
      "title": "Ask bndy natural-language discovery",
      "detail": "Add a highly polished natural-language layer to the existing discovery search. It converts intent into visible, editable deterministic filters and returns only canonical BNDY gigs through the existing Map and List experiences. It must not present as a chat interface or chatbot persona, and it must never invent gigs or unsupported attributes. Delivery depends on sufficiently rich and reliable genre, act-type, admission, date and location data. Ship only when the interaction is fast, slick and materially better than using the filters directly, never as an AI novelty."
    },
    {
      "id": "recurring-grassroots-sessions",
      "rank": 3,
      "laneId": "core-discovery",
      "title": "Recurring grassroots sessions",
      "detail": "Make venue-hosted open mics, jam nights and folk sessions first-class recurring discovery objects rather than copying dozens of dated gigs. Store one canonical series with Venue, recurrence, optional host Artist, session type, admission, participation details and source provenance; expand only a bounded future window for public discovery. Support excluded dates and occurrence-specific cancellation, time or host overrides. Give sessions clear filters and presentation so they do not masquerade as ordinary gigs. Complete recurrence support through canonical public reads and creation, then ingest and re-verify suitable sources through Backline. Every series must carry lastVerifiedAt and a freshness/expiry policy so an abandoned weekly listing never repeats indefinitely."
    },
    {
      "id": "artist-booking-requests",
      "rank": 4,
      "laneId": "core-discovery",
      "title": "Date-aware Artist booking requests",
      "detail": "Later, let a person choose an available or unlisted date on an Artist profile and send a private booking request through BNDY. BNDY should deliver it to the claimed Artist, provide in-app and explicitly opted-in notifications, and keep request status and replies inside the account experience. Decide consent, spam controls, privacy, response flow and any WhatsApp, email or text fallback before delivery. Do not expand the current availability-calendar work into messaging now. This is dependent on claimed Artist adoption and reliable notifications."
    },
    {
      "id": "replace-static-aws-root-credentials",
      "rank": 5,
      "laneId": "api-security",
      "title": "Replace static AWS root credentials with scoped OIDC roles",
      "detail": "Audit every remaining GitHub Actions reference to static AWS access-key secrets and establish which paths still resolve to the root credentials identified during recovery. Move legitimate deployment and diagnostic paths to least-privilege GitHub OIDC roles, then revoke the root access keys and verify closure through IAM and CloudTrail last-used evidence. Map dependencies before revocation to avoid an accidental outage. This is a separate platform-security task and does not block normal Backline, Claims or product backlog development.",
      "evidence": [
        "https://github.com/flowency-live/bndy-serverless-api/pull/71",
        "https://github.com/flowency-live/bndy-ops/blob/main/cto/BACKLINE-POST-RECOVERY-LIVE-AUDIT-2026-08-30.md"
      ]
    },
    {
      "id": "discovery-image-capture-claim-confirmation",
      "rank": 6,
      "laneId": "join-bndy",
      "title": "Discovery image capture and Claim confirmation",